{
  "$schema": "https://json-schema.org/draft/2020-12/schema",
  "title": "nexoscli.run_manifest.v0.2",
  "type": "object",
  "required": [
    "version",
    "run_id",
    "count",
    "first_seq",
    "last_seq",
    "first_hash",
    "last_hash",
    "time_range"
  ],
  "properties": {
    "version": { "const": "0.2" },
    "run_id": { "type": "string" },
    "count": { "type": "integer", "minimum": 1 },
    "first_seq": { "type": "integer", "minimum": 1 },
    "last_seq": { "type": "integer", "minimum": 1 },
    "first_hash": { "type": "string" },
    "last_hash": { "type": "string" },
    "time_range": {
      "type": "object",
      "required": ["from", "to"],
      "properties": {
        "from": { "type": "string", "format": "date-time" },
        "to": { "type": "string", "format": "date-time" }
      }
    },
    "chain_ok": { "type": "boolean" }
  },
  "additionalProperties": true
}
