{
  "chain_ok": true,
  "count": 1,
  "first_hash": "sha256:47c4c7d74d89ec14b7858d649e881a354df5a809e5e16cd853845690e3f7deb2",
  "first_seq": 1,
  "last_hash": "sha256:47c4c7d74d89ec14b7858d649e881a354df5a809e5e16cd853845690e3f7deb2",
  "last_seq": 1,
  "run_id": "d6d1c4f0-9955-4c3a-a008-1dc4a7975af8",
  "time_range": {
    "from": "2025-09-09T14:31:06.153273Z",
    "to": "2025-09-09T14:31:06.153273Z"
  },
  "version": "0.2"
}