{
  "chain_ok": true,
  "count": 1,
  "first_hash": "sha256:f19bf2a648f448a4f985f9ef2f33440ad00e727096c2b53fe6d1a31ca862e2e6",
  "first_seq": 1,
  "last_hash": "sha256:f19bf2a648f448a4f985f9ef2f33440ad00e727096c2b53fe6d1a31ca862e2e6",
  "last_seq": 1,
  "run_id": "e077b73b-f3d2-4a9d-b01e-dc3693dd0e38",
  "time_range": {
    "from": "2025-09-09T04:08:54.264474Z",
    "to": "2025-09-09T04:08:54.264474Z"
  },
  "version": "0.2"
}