{
  "chain_ok": true,
  "count": 1,
  "first_hash": "sha256:4b262e34dba858ada49e21a4474e108073929a8ba0c8ab4337acf623c5db66a0",
  "first_seq": 1,
  "last_hash": "sha256:4b262e34dba858ada49e21a4474e108073929a8ba0c8ab4337acf623c5db66a0",
  "last_seq": 1,
  "run_id": "3f1bd233-430e-4a61-9624-daa337d26190",
  "time_range": {
    "from": "2025-09-05T06:56:20.098326Z",
    "to": "2025-09-05T06:56:20.098326Z"
  },
  "version": "0.2"
}