{
  "chain_ok": true,
  "count": 1,
  "first_hash": "sha256:f19bf2a648f448a4f985f9ef2f33440ad00e727096c2b53fe6d1a31ca862e2e6",
  "first_seq": 1,
  "last_hash": "sha256:f19bf2a648f448a4f985f9ef2f33440ad00e727096c2b53fe6d1a31ca862e2e6",
  "last_seq": 1,
  "run_id": "e7f8ea0a-6ea8-4aa4-9876-364ad09808a3",
  "time_range": {
    "from": "2025-09-09T13:38:09.777164Z",
    "to": "2025-09-09T13:38:09.777164Z"
  },
  "version": "0.2"
}