{
  "chain_ok": true,
  "count": 1,
  "first_hash": "sha256:d638c60a67417501076242a01734f1d3d55d93a4bed05b6c868eb266c0c0a010",
  "first_seq": 1,
  "last_hash": "sha256:d638c60a67417501076242a01734f1d3d55d93a4bed05b6c868eb266c0c0a010",
  "last_seq": 1,
  "run_id": "3a442882-7eb2-4b40-9eb4-d9b8212ec119",
  "time_range": {
    "from": "2025-09-09T04:55:50.248395Z",
    "to": "2025-09-09T04:55:50.248395Z"
  },
  "version": "0.2"
}