{
  "chain_ok": true,
  "count": 1,
  "first_hash": "sha256:784935a645da77ede59c8ecf6cef2300d9102f1491fde0a548f8eafff415941f",
  "first_seq": 1,
  "last_hash": "sha256:784935a645da77ede59c8ecf6cef2300d9102f1491fde0a548f8eafff415941f",
  "last_seq": 1,
  "run_id": "8f493b21-8e79-4bbb-a99f-2aef2318c35e",
  "time_range": {
    "from": "2025-09-09T15:00:09.44909Z",
    "to": "2025-09-09T15:00:09.44909Z"
  },
  "version": "0.2"
}