{
  "chain_ok": true,
  "count": 1,
  "first_hash": "sha256:18d52633d5fe894187645ca8574f2ef69a731645b3f75a6eda20b7654ed544e1",
  "first_seq": 1,
  "last_hash": "sha256:18d52633d5fe894187645ca8574f2ef69a731645b3f75a6eda20b7654ed544e1",
  "last_seq": 1,
  "run_id": "08086224-ee7f-46b0-a56e-0a0073b80082",
  "time_range": {
    "from": "2025-09-05T21:42:59.378905Z",
    "to": "2025-09-05T21:42:59.378905Z"
  },
  "version": "0.2"
}