{
  "chain_ok": true,
  "count": 1,
  "first_hash": "sha256:06bd28f7ca9e832f74dabcdcbb0057d92bfcdc782a2792087b5c410f10cd177e",
  "first_seq": 1,
  "last_hash": "sha256:06bd28f7ca9e832f74dabcdcbb0057d92bfcdc782a2792087b5c410f10cd177e",
  "last_seq": 1,
  "run_id": "4c066ae1-9b09-42e7-8120-63831c9e6b1b",
  "time_range": {
    "from": "2025-09-09T13:32:04.554651Z",
    "to": "2025-09-09T13:32:04.554651Z"
  },
  "version": "0.2"
}