{
  "chain_ok": true,
  "count": 1,
  "first_hash": "sha256:f19bf2a648f448a4f985f9ef2f33440ad00e727096c2b53fe6d1a31ca862e2e6",
  "first_seq": 1,
  "last_hash": "sha256:f19bf2a648f448a4f985f9ef2f33440ad00e727096c2b53fe6d1a31ca862e2e6",
  "last_seq": 1,
  "run_id": "9c3cba16-afea-4f40-9511-0231a2ebe320",
  "time_range": {
    "from": "2025-09-09T04:12:26.052718Z",
    "to": "2025-09-09T04:12:26.052718Z"
  },
  "version": "0.2"
}