{
  "chain_ok": true,
  "count": 1,
  "first_hash": "sha256:01a56c78366ce95dd8e5968053b2fb42dba7ad4adf97b90d47940494c9fffa19",
  "first_seq": 1,
  "last_hash": "sha256:01a56c78366ce95dd8e5968053b2fb42dba7ad4adf97b90d47940494c9fffa19",
  "last_seq": 1,
  "run_id": "ea613433-e87f-4bf3-bd53-b565ee3a5abc",
  "time_range": {
    "from": "2025-09-09T14:01:49.939305Z",
    "to": "2025-09-09T14:01:49.939305Z"
  },
  "version": "0.2"
}