{
  "chain_ok": true,
  "count": 1,
  "first_hash": "sha256:002f9826aeaf7512f61e6908d829eeb0bd6c951d72f3b1d8bef5e43d8f5c0d0c",
  "first_seq": 1,
  "last_hash": "sha256:002f9826aeaf7512f61e6908d829eeb0bd6c951d72f3b1d8bef5e43d8f5c0d0c",
  "last_seq": 1,
  "run_id": "94df1e59-9b65-407b-b6e6-ae4540fc7f0c",
  "time_range": {
    "from": "2025-09-09T13:29:50.56453Z",
    "to": "2025-09-09T13:29:50.56453Z"
  },
  "version": "0.2"
}