{
  "chain_ok": true,
  "count": 1,
  "first_hash": "sha256:f19bf2a648f448a4f985f9ef2f33440ad00e727096c2b53fe6d1a31ca862e2e6",
  "first_seq": 1,
  "last_hash": "sha256:f19bf2a648f448a4f985f9ef2f33440ad00e727096c2b53fe6d1a31ca862e2e6",
  "last_seq": 1,
  "run_id": "8f4808f3-f138-4a6d-94c8-4e898037f0a4",
  "time_range": {
    "from": "2025-09-09T14:00:48.225223Z",
    "to": "2025-09-09T14:00:48.225223Z"
  },
  "version": "0.2"
}